{
  "schemaVersion": "xfdl-ground-truth.v1",
  "generatedAt": "2026-08-12T14:35:53.316Z",
  "source": {
    "fileName": "Preferred_Mutual CL-77 08_03.Xfdl",
    "relativePath": "training-data/Preferred_Mutual CL-77 08_03.Xfdl",
    "bytes": 162240,
    "sha256": "c3f7620bd1a9a9f190db57ca043532ee2f33df7ff6ec8be46455c3f3ddf6ef3a",
    "encoding": "ISO-8859-1",
    "containerEncoding": "plain-xml",
    "decodedBytes": 162240
  },
  "form": {
    "title": "Avyst",
    "serialNumber": null,
    "version": null,
    "publisher": null,
    "distributor": "Preferred Mutual",
    "identifier": "CL-77",
    "edition": "08 03",
    "formName": "Motel Hotel Supplemental Application",
    "sourceKind": "carrier"
  },
  "pages": [
    {
      "sid": "Page1",
      "index": 0,
      "number": 1,
      "width": 1020,
      "height": 1320,
      "pageSize": "letter",
      "dpi": 120,
      "printSize": [
        8.5,
        11
      ]
    }
  ],
  "fields": [
    {
      "sid": "Form_CompletionDate_A",
      "tag": "field",
      "role": "fillable-field",
      "pageIndex": 0,
      "pageNumber": 1,
      "pageSid": "Page1",
      "geometry": {
        "x": 841,
        "y": 216,
        "width": 133,
        "height": 22,
        "page": null,
        "within": null,
        "operations": [
          {
            "operation": "absolute",
            "args": [
              841,
              216
            ]
          },
          {
            "operation": "extent",
            "args": [
              133,
              22
            ]
          }
        ],
        "coordinateSystem": "xfdl-layout-units",
        "provenance": "explicit"
      },
      "value": null,
      "imageRef": null,
      "helpSid": "HelpForm_CompletionDate_A",
      "helpText": "Enter date: The date on which the form is completed. (MM/DD/YYYY)",
      "nextSid": "Producer_PhoneNumber_A",
      "fieldType": "date",
      "sourceFieldType": "TextBox",
      "format": {
        "dataType": "date",
        "requirement": "Optional",
        "presentation": "MM/DD/YYYY",
        "rawValues": [
          "date",
          "Optional",
          ""
        ],
        "provenance": "explicit"
      },
      "semantic": {
        "semanticPath": "Form_CompletionDate",
        "repeatKey": "A",
        "family": "Form",
        "mapped": true
      },
      "binding": null,
      "behavior": {
        "visible": {
          "initial": "on",
          "expression": null,
          "explicit": false
        },
        "readonly": {
          "initial": "off",
          "expression": null,
          "explicit": false
        },
        "active": {
          "initial": "on",
          "expression": null,
          "explicit": false
        }
      },
      "suppression": {
        "excludedFromFillableGroundTruth": false,
        "suppressedByDefault": false,
        "conditional": false,
        "reasons": [],
        "provenance": "none"
      },
      "sourceOffset": 133366,
      "label": {
        "visualLabelSid": null,
        "visualLabel": null,
        "visualLabelGeometry": null,
        "helpLabel": "Enter date: The date on which the form is completed. (MM/DD/YYYY)",
        "confidence": 0,
        "provenance": "help-text-only"
      }
    },
    {
      "sid": "Producer_PhoneNumber_A",
      "tag": "field",
      "role": "fillable-field",
      "pageIndex": 0,
      "pageNumber": 1,
      "pageSid": "Page1",
      "geometry": {
        "x": 175,
        "y": 292,
        "width": 185,
        "height": 24,
        "page": null,
        "within": null,
        "operations": [
          {
            "operation": "absolute",
            "args": [
              175,
              292
            ]
          },
          {
            "operation": "extent",
            "args": [
              185,
              24
            ]
          }
        ],
        "coordinateSystem": "xfdl-layout-units",
        "provenance": "explicit"
      },
      "value": null,
      "imageRef": null,
      "helpSid": "HelpProducer_PhoneNumber_A",
      "helpText": "Enter number: The phone number of the producer / agency.",
      "nextSid": "Producer_FullName_A",
      "fieldType": "numeric",
      "sourceFieldType": "TextBox",
      "format": {
        "dataType": "string",
        "requirement": null,
        "presentation": "",
        "rawValues": [
          "string",
          "",
          "Optional",
          ""
        ],
        "provenance": "explicit"
      },
      "semantic": {
        "semanticPath": "Producer_PhoneNumber",
        "repeatKey": "A",
        "family": "Producer",
        "mapped": true
      },
      "binding": null,
      "behavior": {
        "visible": {
          "initial": "on",
          "expression": null,
          "explicit": false
        },
        "readonly": {
          "initial": "off",
          "expression": null,
          "explicit": false
        },
        "active": {
          "initial": "on",
          "expression": null,
          "explicit": false
        }
      },
      "suppression": {
        "excludedFromFillableGroundTruth": false,
        "suppressedByDefault": false,
        "conditional": false,
        "reasons": [],
        "provenance": "none"
      },
      "sourceOffset": 134109,
      "label": {
        "visualLabelSid": null,
        "visualLabel": null,
        "visualLabelGeometry": null,
        "helpLabel": "Enter number: The phone number of the producer / agency.",
        "confidence": 0,
        "provenance": "help-text-only"
      }
    },
    {
      "sid": "Producer_FullName_A",
      "tag": "field",
      "role": "fillable-field",
      "pageIndex": 0,
      "pageNumber": 1,
      "pageSid": "Page1",
      "geometry": {
        "x": 45,
        "y": 339,
        "width": 315,
        "height": 25,
        "page": null,
        "within": null,
        "operations": [
          {
            "operation": "absolute",
            "args": [
              45,
              339
            ]
          },
          {
            "operation": "extent",
            "args": [
              315,
              25
            ]
          }
        ],
        "coordinateSystem": "xfdl-layout-units",
        "provenance": "explicit"
      },
      "value": null,
      "imageRef": null,
      "helpSid": "HelpProducer_FullName_A",
      "helpText": "Enter text: The full name of the producer / agency.",
      "nextSid": "Insurer_ProducerIdentifier_A",
      "fieldType": "text",
      "sourceFieldType": "TextBox",
      "format": {
        "dataType": "string",
        "requirement": null,
        "presentation": "",
        "rawValues": [
          "string",
          "",
          "Optional",
          ""
        ],
        "provenance": "explicit"
      },
      "semantic": {
        "semanticPath": "Producer_FullName",
        "repeatKey": "A",
        "family": "Producer",
        "mapped": true
      },
      "binding": null,
      "behavior": {
        "visible": {
          "initial": "on",
          "expression": null,
          "explicit": false
        },
        "readonly": {
          "initial": "off",
          "expression": null,
          "explicit": false
        },
        "active": {
          "initial": "on",
          "expression": null,
          "explicit": false
        }
      },
      "suppression": {
        "excludedFromFillableGroundTruth": false,
        "suppressedByDefault": false,
        "conditional": false,
        "reasons": [],
        "provenance": "none"
      },
      "sourceOffset": 134824,
      "label": {
        "visualLabelSid": null,
        "visualLabel": null,
        "visualLabelGeometry": null,
        "helpLabel": "Enter text: The full name of the producer / agency.",
        "confidence": 0,
        "provenance": "help-text-only"
      }
    },
    {
      "sid": "Insurer_ProducerIdentifier_A",
      "tag": "field",
      "role": "fillable-field",
      "pageIndex": 0,
      "pageNumber": 1,
      "pageSid": "Page1",
      "geometry": {
        "x": 45,
        "y": 384,
        "width": 150,
        "height": 22,
        "page": null,
        "within": null,
        "operations": [
          {
            "operation": "absolute",
            "args": [
              45,
              384
            ]
          },
          {
            "operation": "extent",
            "args": [
              150,
              22
            ]
          }
        ],
        "coordinateSystem": "xfdl-layout-units",
        "provenance": "explicit"
      },
      "value": null,
      "imageRef": null,
      "helpSid": "HelpInsurer_ProducerIdentifier_A",
      "helpText": "Enter code: The identification code assigned to the producer (e.g., agency or brokerage firm) by the insurer.",
      "nextSid": "Insurer_SubProducerIdentifier_A",
      "fieldType": "text",
      "sourceFieldType": "TextBox",
      "format": {
        "dataType": "string",
        "requirement": null,
        "presentation": "",
        "rawValues": [
          "string",
          "",
          "Optional",
          ""
        ],
        "provenance": "explicit"
      },
      "semantic": {
        "semanticPath": "Insurer_ProducerIdentifier",
        "repeatKey": "A",
        "family": "Insurer",
        "mapped": true
      },
      "binding": null,
      "behavior": {
        "visible": {
          "initial": "on",
          "expression": null,
          "explicit": false
        },
        "readonly": {
          "initial": "off",
          "expression": null,
          "explicit": false
        },
        "active": {
          "initial": "on",
          "expression": null,
          "explicit": false
        }
      },
      "suppression": {
        "excludedFromFillableGroundTruth": false,
        "suppressedByDefault": false,
        "conditional": false,
        "reasons": [],
        "provenance": "none"
      },
      "sourceOffset": 135533,
      "label": {